"","date","source","section","title","description","url"
"119","10-30-2018","timesofindia","sport","Pro Kabaddi: Telugu Titans crush Patna Pirates 53-32","Telugu Titans outclassed Patna Pirates 53-32 for their fourth win of the Pro Kabaddi League season six at the Patliputra Sports Complex in Patna on Tuesday.","https://timesofindia.indiatimes.com/sports/pro-kabaddi-league/pro-kabaddi-rahul-chaudhari-stars-as-telugu-titans-crush-patna-pirates-53-32/articleshow/66436200.cms"
"120","10-30-2018","timesofindia","sport","Khaleel Ahmed officially warned for provocative action","Young Indian fast bowler Khaleel Ahmed was issued an official warning for a Level 1 breach of the ICC Code of Conduct for Players and Player Support Personnel during the fourth ODI against West Indies in Mumbai on Monday. The incident happened in the 14th over when the left-arm pacer advanced aggressively towards Marlon Samuels after dismissing him.","https://timesofindia.indiatimes.com/sports/cricket/west-indies-in-india/india-vs-west-indies-khaleel-ahmed-officially-warned-for-provocative-action/articleshow/66428593.cms"
"121","10-30-2018","timesofindia","sport","Roger Federer confirms Paris Masters participation","Roger Federer on Tuesday confirmed his participation at this year's Paris Masters after a three-year absence.","https://timesofindia.indiatimes.com/sports/tennis/top-stories/roger-federer-confirms-paris-masters-participation/articleshow/66435228.cms"
"122","10-30-2018","timesofindia","sport","Eileen Ash - The oldest living Test cricketer turns 107 today","107 Not Out! The oldest living Test cricketer in world, Eileen Ash celebrated her 107th birthday on Tuesday.","https://timesofindia.indiatimes.com/sports/cricket/news/eileen-ash-the-oldest-living-test-cricketer-turns-107-today/articleshow/66430876.cms"
"123","10-30-2018","timesofindia","sport","Pro Kabaddi: Gujarat Fortune Giants beat Puneri Paltan","Gujarat Fortune Giants beat Puneri Paltan 37-27 to continue their impressive form in the Pro Kabaddi League Season 6 on Tuesday.","https://timesofindia.indiatimes.com/sports/pro-kabaddi-league/pro-kabaddi-gujarat-fortune-giants-beat-puneri-paltan/articleshow/66435054.cms"
"124","10-30-2018","timesofindia","sport","Encouraging start to I-League with impressive attendance figures: AIFF","The 12th edition of the I-League began in an encouraging note with impressive attendance of football fans in five venues across the country, the national federation said on Tuesday.","https://timesofindia.indiatimes.com/sports/football/i-league/encouraging-start-to-i-league-with-impressive-attendance-figures-aiff/articleshow/66433343.cms"
"125","10-30-2018","timesofindia","sport","Services captain recalls Tendulkar's 2013 pep talk","It's been four years since Sachin Tendulkar delighted the Palam crowd, but Services captain Rajat Paliwal still relishes the moment and feels honoured to have shared the same scoresheet with the Indian batting legend.","https://timesofindia.indiatimes.com/sports/cricket/news/ranji-trophy-2018-19-services-captain-rajat-paliwal-recalls-sachin-tendulkars-2013-pep-talk/articleshow/66428747.cms"
"126","08-18-2009","timesofindia","health","Now just pop a pill to stop blood clots","Blood clots, which are responsible foir killing many people every year, can now be treated without needles, i.e by oral medication.","https://timesofindia.indiatimes.com/Now-just-pop-a-pill-to-stop-blood-clots/articleshow/4905951.cms"
"127","08-17-2009","timesofindia","health","Hysterectomy through belly button leaves no scars","Doctors have operated on a woman which they claim is the first hysterectomy in Europe through a tiny incision in her belly button, leaving no visible outward scars.","https://timesofindia.indiatimes.com/Hysterectomy-through-belly-button-leaves-no-scars/articleshow/4904370.cms"
"128","08-17-2009","timesofindia","health","Kissing can cause herpes","The Australian Herpes Management Forum says that once you are affected with the Herpes virus, it stays in the body and can reactivate at any time.","https://timesofindia.indiatimes.com/Kissing-can-cause-herpes/articleshow/4902526.cms"
"129","08-17-2009","timesofindia","health","A sweeter broccoli to cut heart diseases","Scientists claimed to have developed a new variety of broccoli that is not only grown naturally, but also tastes sweeter and has 40% more anti-oxidants than the normal to reduce risks of heart disease and cancer.","https://timesofindia.indiatimes.com/A-sweeter-broccoli-to-cut-heart-diseases/articleshow/4901158.cms"
"130","08-17-2009","timesofindia","health","'Havan' for bacteria-free homes: Study","Want to lead a healthy life and free your home from bacteria? Perform 'havan' at regular intervals.","https://timesofindia.indiatimes.com/Havan-for-bacteria-free-homes-Study/articleshow/4900831.cms"
"131","08-16-2009","timesofindia","health","A cot mattress that mimics the womb","It's a dream come true for tired-out-moms, a revolutionary new cot mattress which mimics the sensation of the womb to keep babies happy at night.","https://timesofindia.indiatimes.com/A-cot-mattress-that-mimics-the-womb/articleshow/4899153.cms"
"132","08-16-2009","timesofindia","health","India should trains its doctors in infectious diseases","With India battling swine flu, an eminent Indian-American doctor has said it is the right time the government in the country accelerate process of training its doctors in infectious diseases or else it could be too late to bring the situation under control.","https://timesofindia.indiatimes.com/India-should-trains-its-doctors-in-infectious-diseases/articleshow/4898948.cms"
"133","02-16-2015","timesofindia","health","10 home remedies to avoid swine flu","Are the rising swine flu casualties giving you jitters?","https://timesofindia.indiatimes.com/10-home-remedies-to-avoid-swine-flu/articleshow/4888598.cms"
"134","08-11-2009","timesofindia","health","Cadila to apply for clinical trials for swine flu vaccine","Cadila Pharmaceutical will seek the govt's nod in two days for initiating clinical trials for a vaccine against swine flu.","https://timesofindia.indiatimes.com/Cadila-to-apply-for-clinical-trials-for-swine-flu-vaccine/articleshow/4881843.cms"
"135","08-11-2009","timesofindia","health","Synthetic bedding 'can cause asthma'","A new study has claimed synthetic bedding can aggravate asthma more than feather products as it contains high levels of fungal cells.","https://timesofindia.indiatimes.com/Synthetic-bedding-can-cause-asthma/articleshow/4880666.cms"
"136","08-10-2009","timesofindia","health","New wave of Swine flu could sicken millions","As countries grapple with the Swine flu, experts have warned that a new wave of the deadly virus is ready and could sicken millions.","https://timesofindia.indiatimes.com/New-wave-of-Swine-flu-could-sicken-millions/articleshow/4878048.cms"
"137","08-10-2009","timesofindia","health","Now, an HIV blocking gel for women","Scientists have developed a ""molecular condom"", which they claim is a vaginal gel to help protect women from contracting HIV during sexual intercourse.","https://timesofindia.indiatimes.com/Now-an-HIV-blocking-gel-for-women/articleshow/4876890.cms"
"138","08-09-2009","timesofindia","health","Homeopathy can cure swine flu, claims practitioner","At a time the country is grappling with H1N1 virus and Tamiflu tablet is belived to be the only solution, a well-known medical practitioner today claimed that people can have a cost-effective treatment in homeopathy for swine flu.","https://timesofindia.indiatimes.com/Homeopathy-can-cure-swine-flu-claims-practitioner/articleshow/4874614.cms"
"139","08-05-2009","timesofindia","health","Breast cancer cases surge as cervical dips","Fewer women in India now suffer from cervical cancer - counted among the worst of killers. However, breast cancer cases have shot up alarmingly.","https://timesofindia.indiatimes.com/Breast-cancer-cases-surge-as-cervical-dips/articleshow/4861388.cms"
"140","08-04-2009","timesofindia","health","Why dentures? Grow new teeth","Scientists in Japan have managed to grow teeth from stem cells, a development that could make dentures redundant.","https://timesofindia.indiatimes.com/Why-dentures-Grow-new-teeth/articleshow/4858155.cms"
"141","08-04-2009","timesofindia","health","Men who do household chores more likely to marry","According to University of Oxford, Men who do household chores are more likely to marry a girl of their choice.","https://timesofindia.indiatimes.com/Men-who-do-household-chores-more-likely-to-marry/articleshow/4857184.cms"
"142","08-04-2009","timesofindia","health","OTC EC and abortion pills cause menstrual problems","Gynaecologists have noticed a sharp spike in cases of menstrual complications among young women who are repeatedly using OTC EC and abortion pills.","https://timesofindia.indiatimes.com/OTC-EC-and-abortion-pills-cause-menstrual-problems/articleshow/4854058.cms"
"143","08-01-2009","timesofindia","health","UV radiation blinding rural folk, finds study","Why is every alternate person in rural India above the age of 40 blinded by cataract when only one in five in cities has the disease?","https://timesofindia.indiatimes.com/UV-radiation-blinding-rural-folk-finds-study/articleshow/4847122.cms"
"144","07-30-2009","timesofindia","health","70m diabetics in India by 2015: Study","India is heading towards a diabetic explosion with 70 million people to be affected by 2015, a decade ahead of expectations.","https://timesofindia.indiatimes.com/70m-diabetics-in-India-by-2015-Study/articleshow/4836201.cms"
"145","07-28-2009","timesofindia","health","Texting while driving increases risk of crashing","Don't text while driving as a new study suggests that doing so increases the risk of a crash much more than talking or listening on a mobile phone.","https://timesofindia.indiatimes.com/Texting-while-driving-increases-risk-of-crashing/articleshow/4828947.cms"
"146","10-21-2018","timesofindia","science","Unique 'fingerprints' can help track 3D-printed guns","According to researchers from University at Buffalo in the US, 3D-printers leave unique 'fingerprints' on its products, which can be identified by their ""PrinTracker"". Like a common inkjet printer, 3D printers move back-and-forth while ""printing"" an object.","https://timesofindia.indiatimes.com/home/science/unique-fingerprints-can-help-track-3d-printed-guns/articleshow/66303100.cms"
"147","06-25-2018","timesofindia","science","Chinese scientists complete genome sequencing of tropical sage plant","Xin Haibo, senior engineer with the Beijing Institute of Gardening Science and a member of the research team, said establishing the plant's genetic mechanism is valuable for breeding and editing the genomes of other co-ordinal plants.","https://timesofindia.indiatimes.com/home/science/chinese-scientists-complete-genome-sequencing-of-tropical-sage-plant/articleshow/64734114.cms"
"148","10-09-2018","timesofindia","science","'New drugs to prevent tuberculosis in the offing'","The causative agent of tuberculosis, Mycobacterium
tuberculosis, is a highly successful pathogen which can survive and grow in
humans for decades. Researchers have identified a novel regulatory mechanism,
which when deactivated, results in the death of tuberculosis pathogen, an
advance that could pave the way for new drugs to prevent the disease.","https://timesofindia.indiatimes.com/home/science/new-drugs-to-prevent-tuberculosis-in-the-offing/articleshow/66135152.cms"
"149","06-03-2018","timesofindia","science","New material can help tooth enamel regenerate","Enamel, located on the outer part of our teeth, is the hardest tissue in the body and enables our teeth to function for a large part of our lifetime despite biting forces, exposure to acidic foods and drinks and extreme temperatures.","https://timesofindia.indiatimes.com/home/science/new-material-can-help-tooth-enamel-regenerate/articleshow/64436314.cms"
"150","05-29-2018","timesofindia","science","Why heart function is reduced at high altitude decoded","Over the years, several theories have been proposed to explain the reduction in the amount of blood the heart can pump; this was even of interest to the scientists involved in the first summit of Mount Everest in the 1950's.","https://timesofindia.indiatimes.com/home/science/why-heart-function-is-reduced-at-high-altitude-decoded/articleshow/64371063.cms"
"151","05-27-2018","timesofindia","science","New element with magnetic properties discovered","The discovery, led by researchers at the University of Minnesota in the US, could be used to improve sensors, devices in the computer memory and logic industry, or other devices using magnetic materials.","https://timesofindia.indiatimes.com/home/science/new-element-with-magnetic-properties-discovered/articleshow/64340455.cms"
"152","05-08-2018","timesofindia","science","New antibodies may lead to universal Ebola vaccine, reveals study","","https://timesofindia.indiatimes.com/home/science/new-antibodies-may-lead-to-universal-ebola-vaccine-reveals-study/articleshow/64076004.cms"
"153","03-20-2018","timesofindia","science","Beet compound may help treat Alzheimer's: Study","Researchers at the University of South Florida in the US found that the compound could slow the accumulation of misfolded proteins in the brain, a process associated with Alzheimer's.","https://timesofindia.indiatimes.com/home/science/beet-compound-may-help-treat-alzheimers-study/articleshow/63381839.cms"
"154","03-06-2018","timesofindia","science","Lung fibrosis can be reduced by restoring lipid synthesis","According to a Thomas Jefferson University-study, restoring the lipids that help keep lung tissue flexible and inflated can help slow disease progression in laboratory models of pulmonary fibrosis.","https://timesofindia.indiatimes.com/home/science/lung-fibrosis-can-be-reduced-by-restoring-lipid-synthesis/articleshow/63181509.cms"
"155","02-26-2018","timesofindia","science","'Happy space suits' may prevent depression in astronauts","Scientists are developing 'happy space suits' that can monitor symptoms of depression in astronauts, and provide real time feedback to improve the atmosphere of the spacecraft as well as boost the occupants' mood.","https://timesofindia.indiatimes.com/home/science/happy-space-suits-may-prevent-depression-in-astronauts/articleshow/63078678.cms"
"156","02-26-2018","timesofindia","science","Water distributed across lunar surface: Nasa probe on Chandrayaan-1","The water appears to be present day and night, though it's not necessarily easily accessible, said Nasa in a statement.","https://timesofindia.indiatimes.com/home/science/water-distributed-across-lunar-surface-nasa-probe-on-chandrayaan-1/articleshow/63073053.cms"
"157","02-14-2018","timesofindia","science","Piece of Mars going home onboard NASA's 2020 rover","A massive chunk of a martian meteorite will be carried onboard NASA's Mars 2020 rover mission, to serve as target practice for a high-precision laser on the rover's arm.","https://timesofindia.indiatimes.com/home/science/piece-of-mars-going-home-onboard-nasas-2020-rover/articleshow/62914258.cms"
"158","12-08-2017","timesofindia","science","'Black holes have weaker magnetic fields than thought'","The findings, published in the journal Science, will help scientists solve the half-century-old mystery of how 'jets' of particles travelling at nearly the speed of light shoot out of black holes' magnetic fields, while everything else is sucked into their abysses.","https://timesofindia.indiatimes.com/home/science/black-holes-have-weaker-magnetic-fields-than-thought-says-study/articleshow/61978241.cms"
"159","11-13-2017","timesofindia","science","Hair bleach chemical triggered life on Earth: study","A compound commonly used in hair bleach, hydrogen peroxide, was the vital ingredient in rock pores around underwater heat vents that set in train a sequence of chemical reactions that led to the first forms of life, according to lead researcher Rowena Ball from the Australian National University (ANU).","https://timesofindia.indiatimes.com/home/science/hair-bleach-chemical-triggered-life-on-earth-study/articleshow/61624785.cms"
"160","11-11-2017","timesofindia","science","Gene therapy helps treat life-threatening skin disease","Scientists have successfully treated a child suffering from extensive skin damage due to a genetic disease using transplants derived from genetically modified cells.","https://timesofindia.indiatimes.com/home/science/gene-therapy-helps-treat-life-threatening-skin-disease/articleshow/61604124.cms"
"161","11-06-2017","timesofindia","science","India's space observatory accomplishes X-ray polarisation",": Astrosat, India's first dedicated multi-wavelength space observatory, has accomplished the extremely strenuous job of X-ray polarisation, putting up a strong challenge to prevailing theories of high energy radiation from pulsars.","https://timesofindia.indiatimes.com/home/science/indias-space-observatory-accomplishes-x-ray-polarisation/articleshow/61535714.cms"
"162","11-01-2017","timesofindia","science","'Monster' planet discovery challenges formation theory","Scientists have discovered a 'monster' planet orbiting a small, distant star, a finding that defies theories which state that such a massive planetary body cannot form around a small stellar host. The newly discovered planet 'NGTS-1b' however, is a 'gas giant'.","https://timesofindia.indiatimes.com/home/science/monster-planet-discovery-challenges-formation-theory/articleshow/61409280.cms"
"163","10-31-2017","timesofindia","science","'Massive black holes may be lurking on edge of Milky Way'","","https://timesofindia.indiatimes.com/home/science/massive-black-holes-may-be-lurking-on-edge-of-milky-way/articleshow/61374135.cms"
"164","10-31-2017","timesofindia","science","New nutrient drink may ward off Alzheimer's disease","Scientists have developed a nutrient cocktail which may slow down cognitive impairment in the early stages of Alzheimer's disease. Researchers have developed a nutrient cocktail aimed at treating what they consider is ""the root cause"" of Alzheimer's - loss of brain synapses.","https://timesofindia.indiatimes.com/home/science/new-nutrient-drink-may-ward-off-alzheimers-disease/articleshow/61362609.cms"
"165","10-27-2017","timesofindia","science","Ancient ocean remnants found on dwarf planet Ceres: NASA","NASA's Dawn mission to Ceres has found the evidence of residual liquid left over from an ancient global ocean on the dwarf planet. They suggest that there is a softer, easily deformable layer beneath Ceres' rigid surface crust, which could be the signature of residual liquid.","https://timesofindia.indiatimes.com/home/science/ancient-ocean-remnants-found-on-dwarf-planet-ceres-nasa/articleshow/61271470.cms"
"166","09-15-2016","timesofindia","technology","Apple iPhone 7, iPhone 7 Plus price details revealed, goes up to Rs 92,000","The iPhone 7 Plus 32GB, 128GB and 256GB will cost Rs 72,000, Rs 82,000 and Rs 92,000 respectively","https://timesofindia.indiatimes.com/tech-news/Apple-iPhone-7-iPhone-7-Plus-price-details-revealed-goes-up-to-Rs-92000/articleshow/54345770.cms"
"167","09-15-2016","timesofindia","technology","Apple slashes prices of iPhone 6s and iPhone 6s Plus by up to Rs 22,000","Apple has announced biggest-ever price drop for its smartphones in India. Under the new pricing, iPhone 6S (128GB), carying an MRP of Rs 82,000, will now be available at an MRP of Rs 60,000. iPhone 6s Plus (128GB) will now be available at an MRP of Rs 70,000,  the smartphone too has received a price cut of Rs 22,000. Apple's 4-inch smartphone iPhone SE, too has got a price cut. The 64GB version of iPhone SE will now be available at Rs 44,000.","https://timesofindia.indiatimes.com/tech-news/Apple-slashes-prices-of-iPhone-6s-and-iPhone-6s-Plus-by-up-to-Rs-22000/articleshow/54343205.cms"
"168","09-15-2016","timesofindia","technology","WhatsApp privacy policy challenged in Delhi High Court: 5 things to know","A public interest litigation in the Delhi High Court (HC) challenges the change in WhatsApp's privacy policy.","http://timesofindia.indiatimes.com/tech/slideshows/WhatsApp-privacy-policy-challenged-in-Delhi-High-Court-5-things-to-know/itslideshow/54332813.cms"
"169","09-15-2016","timesofindia","technology","Apple iOS 10 surpasses iOS 9 in early adoption in just 24 hours","iOS 10 reached 14.45% of eligible devices in the first 24 hours of its release. In comparison, iOS 9 was on 12.60% of eligible device within 24 hours of it being released for all users.","https://timesofindia.indiatimes.com/tech-news/Apple-iOS-10-surpasses-iOS-9-in-early-adoption-in-just-24-hours/articleshow/54346446.cms"
"170","09-14-2016","timesofindia","technology","Fitbit Charge 2 review: Towards a healthier you","Fitness tracking wearables maker Fitbit recently launched its Charge 2 and Flex 2 fitness trackers in India. While the Flex 2 is priced at Rs 9,499, the more expensive Charge 2 bears a price tag of Rs 14,999. The new Fitbit Charge 2 has a heart-rate monitor, a feature previously limited to the 'HR' edition of the Charge only. It comes with a touch-sensitive OLED display, as well as a 3-axis accelerometer, an altimeter and a vibration motor. Fitbit Charge 2 syncs with its companion smartphone app over Bluetooth.","https://timesofindia.indiatimes.com/reviews/Fitbit-Charge-2-review-Towards-a-healthier-you/articleshow/54328890.cms"
"171","09-14-2016","timesofindia","technology","Apple iPhone 7, iPhone 7 Plus available for pre-order in India","All those Apple fans out there in India waiting desperately to lay there hands on the next iPhones -- iPhone 7 and iPhone 7 Plus -- can now pre-order the new smartphones.","https://timesofindia.indiatimes.com/tech-news/Apple-iPhone-7-iPhone-7-Plus-available-for-pre-orders-in-India/articleshow/54324516.cms"
"172","09-14-2016","timesofindia","technology","Apple CEO Tim Cook on India, Steve Jobs, missteps and more","Apple CEO Tim Cook is a man of few words. In an interview to Washington Post, the usually reticent CEO of one of the world's most valuable company talked about a number of things including the 'enormous India opportunity', Steve Jobs, mistakes made during his tenure so far and much more.","http://timesofindia.indiatimes.com/tech/slideshows/Apple-CEO-Tim-Cook-on-India-Steve-Jobs-missteps-and-more/itslideshow/54329607.cms"
"173","09-14-2016","timesofindia","technology","RCom, Aircel announce merger; create fourth largest telco in India","​Reliance Communications and Aircel will hold 50% stake each in the new combined entity, which will be listed later. Both companies will also transfer debt of Rs 14,000 crore each. As for the net worth of the new company, it’ll be around Rs 35,000 crore.","https://timesofindia.indiatimes.com/tech-news/RCom-Aircel-announce-merger-create-fourth-largest-telco-in-India/articleshow/54331909.cms"
"174","09-14-2016","timesofindia","technology","Android Marshmallow share increases, still stays behind Lollipop","Although a significant increase, Android Marshmallow still lies below Android Lollipop, and Kitkat on the list. As per the latest distribution numbers, Android Lollipop 5.0 and v5.1 together run on 35% Android devices, followed by Android Kitkat 4.4 with a 27.7% share.","https://timesofindia.indiatimes.com/tech-news/Android-Marshmallow-share-increases-still-stays-behind-Lollipop/articleshow/54330541.cms"
"175","09-14-2016","timesofindia","technology","Apple watchOS 3, tvOS 10: Top features and download guide","To download watchOS 3, users are recommended to install the latest iOS version and keep the Apple Watch’s minimum charge of up to 50%.","https://timesofindia.indiatimes.com/tech-news/Apple-watchOS-3-tvOS-10-Top-features-and-download-guide/articleshow/54330329.cms"
"176","09-14-2016","timesofindia","technology","WhatsApp defends its new privacy policy in Delhi High Court","Instant messaging platform WhatsApp today opposed in Delhi High Court a plea alleging that privacy of its users has been threatened by a new privacy policy announced by Facebook, saying regulations were in place and the latter does not have access to any data as it provides end-to-end encryption.","https://timesofindia.indiatimes.com/tech-news/WhatsApp-defends-its-new-privacy-policy-in-Delhi-High-Court/articleshow/54333806.cms"
"177","09-14-2016","timesofindia","technology","Facebook rolls out Discover Groups feature in India","The feature lets users browse through groups divided into 25 categories such as parenting, sports, food, buy & sell and more. Each topic page highlights the top suggested groups, based on popularity and group members that users might already know.","https://timesofindia.indiatimes.com/tech-news/Facebook-rolls-out-Discover-Groups-feature-in-India/articleshow/54331489.cms"
"178","09-14-2016","timesofindia","technology","Motorola Moto E3 Power smartphone to launch in India on September 19","Lenovo-owned Motorola is all set to launch its latest budget smartphone – Moto E3 Power, in India. The company has confirmed on its social channels that it will be launching the Moto E3 Power at an event scheduled for September 19. The smartphone will be available exclusively on Flipakrt.","https://timesofindia.indiatimes.com/tech-news/Motorola-Moto-E3-Power-smartphone-to-launch-in-India-on-September-19/articleshow/54335458.cms"
"179","09-14-2016","timesofindia","technology","Your new gadget is just an EMI away","Financial technology startup Finomena lets you buy high-end products and devices through EMIs without a credit score.","https://timesofindia.indiatimes.com/computing/Your-new-gadget-is-just-an-EMI-away/articleshow/54330637.cms"
