"","date","source","section","title","description","url"
"66","10-31-2018","timesofindia","business","Cognizant banking delivery head Nachiket Deshpande quits","Deshpande, who joined Cognizant as an architect in 1999, went on to head the BFS product solutions business and incubated it in emerging markets. He was also the delivery head for the infrastructure services business and played a key role in Cognizant’s $2.7-billion acquisition of Trizetto.","https://timesofindia.indiatimes.com/business/india-business/cognizant-banking-delivery-head-nachiket-deshpande-quits/articleshow/66440334.cms"
"67","10-31-2018","timesofindia","business","Markets open higher, Sensex up 100 points; Nifty above 10,200","Infosys, Yes Bank, HDFC, Vedanta amd Mahindra and Mahindra were among the major gainers on the BSE index, rising as much as 2.27 per cent. On NSE, sub-indices Nifty IT and PSU Bank surged the most by gaining as much as 1.26 per cent.","https://timesofindia.indiatimes.com/business/india-business/markets-open-higher-sensex-up-100-points-nifty-above-10200/articleshow/66440090.cms"
"68","10-31-2018","timesofindia","business","RBI governor exits finance ministry via side gate","Urjit Patel had come to attend a routine meeting of the Financial Stability and Development Council, headed by the finance minister. The exit was carefully planned as Patel took the side gate out of North Block, where his car was waiting for him. But unlike their boss, the deputy governors chose to take the main door, although none of them spoke to reporters.","https://timesofindia.indiatimes.com/business/india-business/rbi-governor-exits-finance-ministry-via-side-gate/articleshow/66438587.cms"
"69","10-31-2018","timesofindia","business","IL&FS likely to sell off a dozen NH projects","These projects involved investment of at least Rs 14,000 crore, sources in the National Highways Authority of India (NHAI) said. IL&FS representatives said they would soon appoint a professional for valuation of the completed stretches to assess how much they can get from selling these revenue generating projects.","https://timesofindia.indiatimes.com/business/india-business/debt-laden-ilfs-likely-to-sell-off-a-dozen-toll-generating-nh-projects/articleshow/66438512.cms"
"70","10-30-2018","timesofindia","business","SBI halves daily ATM withdrawal limit for certain users","The withdrawal limit has been curtailed on Classic and Maestro debit cards, held by a large number of the bank customers. However, customers with other variants of SBI debit card can continue to enjoy higher daily withdrawal from ATMs.","https://timesofindia.indiatimes.com/business/india-business/sbi-halves-daily-atm-withdrawal-limit-to-rs-20000-for-certain-card-holders-from-tomorrow/articleshow/66433102.cms"
"71","10-30-2018","timesofindia","business","Arun Jaitley-led panel discusses NBFC liquidity issues","Reserve Bank governor Urjit Patel said the liquidity problem in NBFCs is not as severe as is being projected, but assured the government that it would ensure adequate liquidity in the system, sources said. The government, on its part, asked the RBI to prevent spreading of IL&FS crisis to other sectors of the economy, sources added.","https://timesofindia.indiatimes.com/business/india-business/fsdc-discusses-nbfc-liquidity-issues-rbi-assures-adequate-fund-flow-in-system/articleshow/66429884.cms"
"72","10-30-2018","timesofindia","business","Govt may consider outright sale of debt-ridden IL&FS","A plan to be presented to a bankruptcy court on Wednesday by the state-appointed board of the lender includes selling the entire stake to a financially strong investor and ensure business continuity. Other options include splitting businesses according to verticals and disposing them off to several buyers or injecting liquidity at group level.","https://timesofindia.indiatimes.com/business/india-business/government-may-consider-outright-sale-of-debt-ridden-ilfs/articleshow/66430609.cms"
"73","10-30-2018","timesofindia","business","Centre, states apportion Rs 32k cr IGST in Oct","The apportionment would add to the goods and services tax (GST) revenue of both the centre and states for October. The total revenue collection figures for the month would be released on November 1.","https://timesofindia.indiatimes.com/business/india-business/centre-states-apportion-rs-32000-crore-igst-in-october/articleshow/66429120.cms"
"74","10-30-2018","timesofindia","business","Finance minister criticises RBI for lending excess","""The central bank looked the other way when banks gave loans indiscriminately during 2008 to 2014,"" Arun Jaitley said while speaking at an event in New Delhi.","https://timesofindia.indiatimes.com/business/india-business/finance-minister-arun-jaitley-criticises-rbi-for-lending-excess/articleshow/66426216.cms"
"75","10-30-2018","timesofindia","business","RBI vs government: 10 flash points","What is unusual about the current standoff is the number of issues it has spilt over to and the length of time it has gone on for. Interest rate, the perpetual point of sparrings, has been overtaken by several other turf wars. Among other issues are dividend payment, February 12 restructuring, regulation of public sector banks, reserves, board appointments etc.","https://timesofindia.indiatimes.com/business/india-business/rbi-vs-government-10-flash-points-between-centre-and-central-bank/articleshow/66425069.cms"
"76","10-30-2018","timesofindia","business","RBI, government differ on NBFC crisis severity","The finance ministry has pushed the RBI for improving liquidity in the system in the wake of the funds crunch for NBFCs, triggered by the default in IL&FS. The ministry is also keen that more credit be directed to small businesses, which are seen to be the drivers for employment and are currently facing stress as their lender NBFCs contract balance sheets.","https://timesofindia.indiatimes.com/business/india-business/rbi-government-differ-on-nbfc-crisis-severity/articleshow/66425237.cms"
"77","10-30-2018","timesofindia","business","NFRA may not be legally valid, says auditor body","“We are willing to implement any reform. We have been honestly discharging our duties under supervision by the government and with government nominees being integral part of the disciplinary process,” ICAI president Naveen Gupta told reporters on Monday.","https://timesofindia.indiatimes.com/business/india-business/nfra-may-not-be-legally-valid-says-auditor-body/articleshow/66423467.cms"
"78","10-30-2018","timesofindia","business","Amazon India close to complying with data law","Amazon has started storing payments data in India locally without mirroring it in their overseas servers, people aware of the matter said.","https://timesofindia.indiatimes.com/business/india-business/amazon-india-close-to-complying-with-data-law/articleshow/66423509.cms"
"79","10-30-2018","timesofindia","business","Top South Korea court orders Japanese firm to pay for forced labour","South Korea's top court on Tuesday ordered a Japanese steel giant to pay compensation over forced wartime labour, a decision likely to further strain ties between the two neighbours. South Korea and Japan are both democracies and US allies faced with an increasingly assertive neighbour China and the long-running threat of nuclear-armed Pyongyang.","https://timesofindia.indiatimes.com/business/international-business/top-south-korea-court-orders-japanese-firm-to-pay-for-forced-labour/articleshow/66426648.cms"
"80","10-30-2018","timesofindia","business","India's key systems run on Red Hat","This might explain the valuation that the $3-billion revenue company has received. Red Hat is the world’s leading provider of enterprise open-source solutions, using a communitypowered approach, unlike traditional software companies that build proprietary systems.","https://timesofindia.indiatimes.com/business/india-business/indias-key-systems-run-on-red-hat/articleshow/66423532.cms"
"81","10-30-2018","timesofindia","business","RBI vs govt: How other central banks function","","https://timesofindia.indiatimes.com/business/india-business/rbi-vs-govt-how-other-central-banks-function/articleshow/66424414.cms"
"82","10-29-2018","timesofindia","business","Re slide, safeguard duty cloud Rs 14k cr solar projects","","https://timesofindia.indiatimes.com/business/india-business/rupee-slide-safeguard-duty-cloud-rs-28000-crore-solar-projects-viability/articleshow/66418838.cms"
"83","10-29-2018","timesofindia","business","CAG urges government to increase retirement age","","https://timesofindia.indiatimes.com/business/india-business/increase-cag-retirement-age-to-70-yrs/articleshow/66418371.cms"
"84","10-29-2018","timesofindia","business","Rupee fall may push govt to seek yuan trade settlement","The plan would enable direct convertibility between the rupee and yuan, and will help cut transaction and hedging costs. The proposal would allow Indian exports of pharmaceuticals, oilseeds and sugar to China to be settled in rupee, while keeping out trade in high volume products such as electronics.","https://timesofindia.indiatimes.com/business/india-business/rupee-slump-may-push-government-to-seek-yuan-trade-settlement/articleshow/66414836.cms"
"85","10-29-2018","timesofindia","business","Reliance Industries faces oil shock at home","Reliance’s refineries processed crude from the nearby Middle East and sold fuel to fast-growing markets in North Asia including China, Japan, South Korea and Taiwan.","https://timesofindia.indiatimes.com/business/india-business/after-years-of-global-success-reliance-industries-faces-oil-shock-at-home/articleshow/66415597.cms"
"86","11-03-2016","timesofindia","sport","ODI tickets worth Rs 52.36 lakh went unsold: Khanna","""Tickets worth Rupees 52,36,000 were unsold. Why all the tickets were not sold-out? DDCA started online ticket sale quite late that too without proper advertisement,"" Khanna claimed in a media release.","https://timesofindia.indiatimes.com/sports/new-zealand-in-india-2016/top-stories/India-v-New-Zealand-ODI-tickets-worth-Rs-52-36-lakh-went-unsold-claims-CK-Khanna/articleshow/55230517.cms"
"87","10-30-2016","timesofindia","sport","Axar Patel breaks into top-10 ODI bowlers","Axar Patel has become the highest placed India bowler in the latest ICC ODI rankings after breaking into the top-10 bowler's list while legspinner Amit Mishra has vaulted 25 places to enter the top-20.","https://timesofindia.indiatimes.com/sports/new-zealand-in-india-2016/top-stories/ICC-ODI-rankings-Axar-Patel-breaks-into-top-10-bowlers-Amit-Mishra-achieves-career-best-spot/articleshow/55141314.cms"
"88","10-30-2016","timesofindia","sport","India ODI series report card: Kohli, Mishra and then some","TOI Sports runs the rule over the performers for India during their 3-2 ODI series win over New Zealand. A report card on the players who featured in India's first ODI series win at home in two years, over NZ across five matches.","https://timesofindia.indiatimes.com/sports/new-zealand-in-india-2016/top-stories/India-ODI-series-report-card-Virat-Kohli-Amit-Mishra-and-then-some/articleshow/55137550.cms"
"89","10-30-2016","timesofindia","sport","Wasn't easy sitting out of Test matches: Mishra","Mishra didn't mince words when asked about the frustration of having to sit out, but added that coach Anil Kumble's tips had helped him tide over the low phase.","https://timesofindia.indiatimes.com/sports/new-zealand-in-india-2016/top-stories/India-v-New-Zealand-5th-ODI-Vizag-Wasnt-easy-sitting-out-of-Test-matches-says-Mishra/articleshow/55137710.cms"
"90","10-30-2016","timesofindia","sport","Talking points: Mishra magic snaps India's home drought","India completed a 3-2 series win over New Zealand by beating them in the decider at Vizag by 190 runs. Here we look at the several passages of play that stood out during the match.","https://timesofindia.indiatimes.com/sports/new-zealand-in-india-2016/top-stories/Ind-v-NZ-5th-ODI-talking-points-Mishra-magic-snaps-Indias-home-drought/articleshow/55137283.cms"
"91","10-29-2016","timesofindia","sport","5th ODI: Mishra five-for spins India to series win","Amit Mishra finished with 5/18, his second ODI five-wicket haul as India beat New Zealand by a whopping 190 runs at Visakhapatnam to clinch the five match ODI series 3-2. Mishra was named both Man of the Match and the Player of the series.","https://timesofindia.indiatimes.com/sports/new-zealand-in-india-2016/top-stories/India-v-New-Zealand-5th-ODI-Vizag-Amit-Mishra-five-for-spins-India-to-series-win/articleshow/55131390.cms"
"92","10-29-2016","timesofindia","sport","Dhoni describes bowlers performance as one of the best","Dhoni lavished praise on his bowlers for the resounding series-clinching win over New Zealand in the fifth and final ODI, describing the effort as ""one of the best performances by the bowlers"".","https://timesofindia.indiatimes.com/sports/new-zealand-in-india-2016/top-stories/Dhoni-describes-bowlers-performance-as-one-of-the-best/articleshow/55133558.cms"
"93","10-29-2016","timesofindia","sport","Kumble's support during lean phase helped me: Mishra","""His (Anil Kumble) mental support is the biggest thing for me. I sat out for the entire Test series but he supported me mentally and told me ""don't worry, your time will come"","" leg-spinner Amit Mishra said.","https://timesofindia.indiatimes.com/sports/new-zealand-in-india-2016/top-stories/India-v-New-Zealand-5th-ODI-Vizag-Kumbles-support-during-lean-phase-helped-me-says-Mishra/articleshow/55134236.cms"
"94","10-29-2016","timesofindia","sport","Our batting today was frustrating: Williamson","Bruised and battered by India after being bundled out for a meagre 79 while chasing 270 in the series-deciding fifth and final ODI, New Zealand skipper Kane Williamson today termed the performance of his batting department as ""frustrating"".","https://timesofindia.indiatimes.com/sports/new-zealand-in-india-2016/top-stories/India-v-New-Zealand-5th-ODI-Vizag-Our-batting-today-was-frustrating-says-Williamson/articleshow/55134569.cms"
"95","10-29-2016","timesofindia","sport","Vizag ODI: India seek festive cheer","The New Zealanders, after being thrashed in the three-match Test series, were expected to put up a much improved show in the One-dayers – a format which they have done well in over the years.","https://timesofindia.indiatimes.com/sports/new-zealand-in-india-2016/top-stories/India-v-New-Zealand-5th-ODI-Vizag-India-seek-festive-cheer/articleshow/55125461.cms"
"96","10-28-2016","timesofindia","sport","Dhoni slogs it out ahead of series decider","Dhoni faced the conventional white ball and practised his trademark shots in a lengthy session at the nets. The series poised at 2-2, Rohit Sharma, Ajinkya Rahane and Virat Kohli stayed away from the nets.","https://timesofindia.indiatimes.com/sports/new-zealand-in-india-2016/top-stories/India-v-New-Zealand-5th-ODI-Vizag-MS-Dhoni-slogs-it-out-ahead-of-series-decider/articleshow/55119138.cms"
"97","10-28-2016","timesofindia","sport","We would like to do what no other NZ side has done: Southee","""I think the guys are pretty excited to do what no other NZ side has ever done before - come over here and win a one-day series. The excitement in the group is very high,"" Tim Southee said on the eve of the series decider.","https://timesofindia.indiatimes.com/sports/new-zealand-in-india-2016/top-stories/India-v-New-Zealand-5th-ODI-Vizag-We-would-like-to-do-what-no-other-NZ-side-has-done-says-Southee/articleshow/55116378.cms"
"98","10-28-2016","timesofindia","sport","Want to successfully overcome challenges thrown at me: Jadhav","​​Jadhav, who's playing in place of an indisposed Suresh Raina, bowled for the first time in international cricket when MS Dhoni gave him the ball ahead of the regular spin duo of Axar Patel and Amit Mishra on a seaming Dharamsala track in the first one-dayer.","https://timesofindia.indiatimes.com/sports/new-zealand-in-india-2016/top-stories/India-v-New-Zealand-5th-ODI-Vizag-Want-to-successfully-overcome-challenges-thrown-at-me-says-Jadhav/articleshow/55113975.cms"
"99","10-28-2016","timesofindia","sport","For MS Dhoni, a final return to where his legend began?","After scores of 0, 12, 7* and 3, MS Dhoni was sent up the order to No. 3 against Pakistan and proceed to smash 148 off 123 balls with 15 fours and four sixes, setting the platform for India's 356/9 at Visakhapatnam in April 2005.","https://timesofindia.indiatimes.com/sports/new-zealand-in-india-2016/top-stories/India-v-New-Zealand-5th-ODI-For-MS-Dhoni-a-final-return-to-where-his-legend-began/articleshow/55111046.cms"
"100","10-28-2016","timesofindia","sport","Under-fire Dhoni faces tricky Kiwis test in series-decider","With conditions overcast, the last thing India would want is a wash-out. Despite weakening, cyclone Kyant, there's forecast of localised downpours as both the teams will keep their fingers crossed.","https://timesofindia.indiatimes.com/sports/new-zealand-in-india-2016/top-stories/India-v-New-Zealand-5th-ODI-Vizag-Under-fire-Dhoni-faces-tricky-Kiwis-test-in-series-decider/articleshow/55110229.cms"
"101","10-28-2016","timesofindia","sport","Dhoni needs strong support cast to rediscover finishing touch","""Batting down the order is one of the toughest things to do. You don't get a (ready-made) player who's complete, who bats at No.5, 6 or 7, all the time,"" skipper MS Dhoni said.","https://timesofindia.indiatimes.com/sports/new-zealand-in-india-2016/top-stories/Dhoni-needs-strong-support-cast-to-rediscover-finishing-touch/articleshow/55106848.cms"
"102","10-27-2016","timesofindia","sport","Dhoni should stick to batting at No 4: Ganguly","Sourav Ganguly insisted that Mahendra Singh Dhoni should stick to batting at No 4 which will enable him and Virat Kohli could play the finishers' role. The former Indian captain however said India were not becoming too much over dependent on Kohli.","https://timesofindia.indiatimes.com/sports/new-zealand-in-india-2016/top-stories/India-v-New-Zealand-5th-ODI-Vizag-Dhoni-should-stick-to-batting-at-No-4-feels-Ganguly/articleshow/55093959.cms"
"103","10-27-2016","timesofindia","sport","We are geared up for the series decider: Taylor","Eyeing a historic bilateral ODI series win in India, New Zealand batsman Ross Taylor said they are hungry to win the five-match series decider on Saturday and make up for the 0-3 whitewash in Tests. ""You don't often win series away from home especially in the sub-continent,"" Taylor said.","https://timesofindia.indiatimes.com/sports/new-zealand-in-india-2016/top-stories/India-v-New-Zealand-5th-ODI-Vizag-We-are-geared-up-for-the-series-decider-says-Ross-Taylor/articleshow/55100056.cms"
"104","10-27-2016","timesofindia","sport","4th ODI: Job of a finisher is one of the toughest, says Dhoni","India's limited overs skipper Mahendra Singh Dhoni has said that the job of a finisher is one of the toughest and it is difficult to find a 'complete' player who is adept at batting in lower order and take the team through when the chips are down.","https://timesofindia.indiatimes.com/sports/new-zealand-in-india-2016/top-stories/India-v-New-Zealand-4th-ODI-Ranchi-Job-of-a-finisher-is-one-of-the-toughest-says-Dhoni/articleshow/55087912.cms"
"105","10-27-2016","timesofindia","sport","4th ODI Talking points: Neesham's deadly blows hurt India","A look at the major talking points from the fourth ODI between India and New Zealand played at Ranchi's JSCA International Stadium on Wednesday where the hosts went down by 19 runs allowing the Kiwis to level the series 2-2","https://timesofindia.indiatimes.com/sports/new-zealand-in-india-2016/top-stories/Ind-v-NZ-4th-ODI-Ranchi-Talking-points-Williamson-bucks-the-trend-and-Neeshams-deadly-blows/articleshow/55084701.cms"
"106","10-31-2018","timesofindia","sport","World Cup beckons 'Tonk Express' Khaleel Ahmed","Khaleel Ahmed, the youngest among India's seamers might be selected for the World Cup especially after his three-wicket show against West Indies in the fourth ODI in Mumbai on Monday. The lanky lad from Tonk in Rajasthan can only hope,  because apart from Bhuvenshwar, Bumrah and Pandya, no seamer has got a fair run in the ODIs in the past 2 years.","https://timesofindia.indiatimes.com/sports/cricket/west-indies-in-india/world-cup-beckons-tonk-express-khaleel-ahmed/articleshow/66438961.cms"
"107","10-31-2018","timesofindia","sport","Pitch for fifth ODI an unknown quantity","A good batting strip is expected at the Sports Hub in the deciding fifth ODI here on Thursday where the West Indies will be looking to square the series. When the Sports Hub hosted its maiden international last year, one noticeable thing was the ball was gripping and coming off the wicket slower, making stroke-play difficult.","https://timesofindia.indiatimes.com/sports/cricket/west-indies-in-india/india-vs-west-indies-pitch-for-fifth-odi-an-unknown-quantity/articleshow/66439221.cms"
"108","10-31-2018","timesofindia","sport","Like cricketers, wrestlers to get central contracts","Wrestling in India is set to get a huge face-lift. In a first for any Olympic discipline in the country, a central contract system will be introduced for the wrestlers – on lines similar to cricket – where the gradation of grapplers will be done based on their performances at various international events.","https://timesofindia.indiatimes.com/sports/more-sports/wrestling/in-a-first-indian-wrestlers-to-get-central-contracts/articleshow/66439666.cms"
"109","10-31-2018","timesofindia","sport","#MeToo: Sourav Ganguly 'fears for' Indian cricket","According to Sourav Ganguly, president, Cricket Association of Bengal, in his letter to BCCI said that “Indian cricket is in danger”. He expressed his displeasure on how the CoA is handling the #MeToo allegation, at the manner in which Ravi Shastri was appointed coach, cricketing rules being changed in the middle of a season and no clarity on who headed the BCCI.","https://timesofindia.indiatimes.com/sports/cricket/news/sourav-ganguly-fires-missive-indian-cricket-is-in-danger-i-fear-for-it/articleshow/66439476.cms"
"110","10-30-2018","timesofindia","sport","MS Dhoni a certainty for 2019 World Cup","A cacophony of critics - who are questioning Dhoni's form with the bat - notwithstanding, the wicketkeeper-batsman isn't going anywhere too soon. For those who complained about the unfair assessment of Dhoni can now rejoice about the fact that the selectors think that the former 2011 World Cup winning captain is still the best wicket-keeper in India.","https://timesofindia.indiatimes.com/sports/cricket/news/ms-dhoni-a-certainty-for-2019-world-cup/articleshow/66434348.cms"
"111","10-31-2018","timesofindia","sport","Baptism by fire for Real Kashmir on I-League debut","Real Kashmir FC will make their much-awaited I-League debut against defending champions Minerva Punjab FC at the Tau Devi Stadium, here on Sunday.","https://timesofindia.indiatimes.com/sports/football/i-league/baptism-by-fire-for-real-kashmir-on-i-league-debut/articleshow/66440022.cms"
"112","10-31-2018","timesofindia","sport","Lopetegui gave up country for club, and lost both","The 52-year-old Lopetegui has now been sacked from the two biggest jobs in Spain’s football – La Roja and Real Madrid – in the space of four months, surely never to get either again, and having left both so, so unfulfilled.","https://timesofindia.indiatimes.com/sports/football/top-stories/julen-lopetegui-gave-up-country-for-club-only-to-lose-them-both/articleshow/66440097.cms"
"113","10-30-2018","timesofindia","sport","Big sports events today","Here are the big sports events lined up for Wednesday (October 31) that comprise action from Indian Super League and Pro Kabaddi.","https://timesofindia.indiatimes.com/sports/more-sports/others/big-sports-events-today/articleshow/66435921.cms"
"114","10-31-2018","timesofindia","sport","'If you cheat, you have to be thrown out' - La Liga chief steps up pressure on PSG","The president of Spain's La Liga, Javier Tebas, has stepped up his criticism of Paris Saint-Germain as he pushed UEFA to kick teams out of the Champions League for breaching their Financial Fair Play rules.","https://timesofindia.indiatimes.com/sports/football/top-stories/if-you-cheat-you-have-to-be-thrown-out-la-liga-chief-steps-up-pressure-on-psg/articleshow/66439649.cms"
"115","10-31-2018","timesofindia","sport","Former FIFA Council member gets life ban for bribery","Former FIFA Council member Kwesi Nyantakyi was banned from soccer for life on Tuesday after being filmed taking bribes by an undercover television program in Ghana.","https://timesofindia.indiatimes.com/sports/football/top-stories/former-fifa-council-member-gets-life-ban-for-bribery/articleshow/66439349.cms"
"116","10-31-2018","timesofindia","sport","Aaron Wise named PGA Rookie of Year","Aaron Wise, who captured his first US PGA Tour title in his 18th start as a member, won the 2018 PGA Tour Rookie of the Year Award on Tuesday.","https://timesofindia.indiatimes.com/sports/golf/aaron-wise-named-pga-rookie-of-year/articleshow/66439927.cms"
"117","10-31-2018","timesofindia","sport","In-form Djokovic eases past Sousa in Paris opener","Novak Djokovic's pursuit of the season-ending world number one spot continued with a 7-5 6-1 victory over Portuguese qualifier Joao Sousa in the second round of the Paris Masters on Tuesday.","https://timesofindia.indiatimes.com/sports/tennis/top-stories/in-form-novak-djokovic-eases-past-joao-sousa-in-paris-opener/articleshow/66439096.cms"
"118","10-30-2018","timesofindia","sport","Pankaj Advani in final of Asian Snooker Tour event","India's top cueist Pankaj Advani on Tuesday stormed into the final of the Asian Snooker Tour's second leg event here after impressive wins in the quarterfinals and semifinals of the championship.","https://timesofindia.indiatimes.com/sports/more-sports/snooker/billiards/pankaj-advani-in-final-of-asian-snooker-tour-event/articleshow/66433871.cms"
